repo_url,filepath,commit_date,message
github.com/stanfordnlp/stanza,demo/pipeline_demo.py,2020-08-11T19:15:55Z,"Merge pull request #422 from stanfordnlp/master

Back-merge documentation changes from master to dev"
github.com/stanfordnlp/stanza,demo/pipeline_demo.py,2020-06-22T23:32:20Z,Rename stanza.resource to stanza.resources; rename resources.py to common.py
github.com/stanfordnlp/stanza,demo/pipeline_demo.py,2020-06-22T22:49:38Z,Move all resources related scripts to stanza/resource
github.com/stanfordnlp/stanza,demo/pipeline_demo.py,2020-06-11T06:04:53Z,Fix demo script
github.com/stanfordnlp/stanza,demo/pipeline_demo.py,2020-03-06T07:45:58Z,renaming stanfordnlp to stanza!!
github.com/stanfordnlp/stanza,demo/pipeline_demo.py,2019-02-19T08:18:42Z,Use sys.exit in place of exit
github.com/stanfordnlp/stanza,demo/pipeline_demo.py,2019-01-31T02:24:01Z,Revert temporary fix for download logic
github.com/stanfordnlp/stanza,demo/pipeline_demo.py,2019-01-31T02:18:05Z,Fix download logic; Fix help message in demo script
github.com/stanfordnlp/stanza,demo/pipeline_demo.py,2019-01-31T01:53:22Z,Quick fix for demo script
github.com/stanfordnlp/stanza,demo/pipeline_demo.py,2019-01-26T05:33:04Z,Separate the classes for Tokens and syntactic Words
github.com/stanfordnlp/stanza,demo/pipeline_demo.py,2019-01-25T09:25:55Z,Undo changes to use_gpu argument
github.com/stanfordnlp/stanza,demo/pipeline_demo.py,2019-01-25T09:16:37Z,Modify the way devices are specified in pipeline
github.com/stanfordnlp/stanza,demo/pipeline_demo.py,2019-01-25T00:25:14Z,Swap French demo input with one that has MWT in the first sentence
github.com/stanfordnlp/stanza,demo/pipeline_demo.py,2019-01-24T22:22:28Z,Accommodate Vietnamese in the pipeline tokenizer processor; Add a Vietnamese example to demo script
github.com/stanfordnlp/stanza,demo/pipeline_demo.py,2019-01-23T08:51:06Z,Demo script goes multi-lingual; don't confirm overwrite by default (by do it in the demo script)
github.com/stanfordnlp/stanza,demo/pipeline_demo.py,2019-01-23T08:51:06Z,Change demo to match logic of new download function: existence of models is checked in download() now; Add easy toggle for other demo languages
github.com/stanfordnlp/stanza,demo/pipeline_demo.py,2019-01-22T23:48:13Z,Modernizing and reusing build_default_config; Path fix in demo pipeline construction
github.com/stanfordnlp/stanza,demo/pipeline_demo.py,2019-01-22T23:31:32Z,Modernizing the demo script; make the download interface more user-friendly
github.com/stanfordnlp/stanza,demo/pipeline_demo.py,2019-01-20T08:10:41Z,update and simplify basic demo
github.com/stanfordnlp/stanza,demo/pipeline_demo.py,2019-01-11T23:37:09Z,add demo
github.com/stanfordnlp/stanza,stanza/utils/training/common.py,2023-11-04T20:42:52Z,"Oops, need to pass the transformer args - otherwise --use_bert without the model name is not correctly testing the dev/test sets"
github.com/stanfordnlp/stanza,stanza/utils/training/common.py,2023-09-10T04:06:24Z,"Properly connect run_ete.py to the charlms (actually, it had even been throwing previous to this change, so the 1.5.1 version is broken)"
github.com/stanfordnlp/stanza,stanza/utils/training/common.py,2023-08-26T07:45:10Z,Add a filter for just the models that have transformers
github.com/stanfordnlp/stanza,stanza/utils/training/common.py,2023-08-22T03:35:43Z,Move the transformer choice to the resources directory and refactor a method that can be used by each of the processors which use the transformers
github.com/stanfordnlp/stanza,stanza/utils/training/common.py,2023-08-20T19:01:06Z,Set the depparse filename based on its model type - need to refactor some more pieces
github.com/stanfordnlp/stanza,stanza/utils/training/common.py,2023-08-18T00:09:25Z,"Track whether or not the POS model is using charlm or transformer in the filename by default
(or pretrain)

Respect an existing --save_name and --save_dir when naming the pos models with run_pos"
github.com/stanfordnlp/stanza,stanza/utils/training/common.py,2023-08-17T06:29:41Z,"If given a command line flag, filter out the models which don't have charlm when running the lemmatizer"
github.com/stanfordnlp/stanza,stanza/utils/training/common.py,2023-08-17T06:29:41Z,Log which treebanks are being used when expanding ud_all
github.com/stanfordnlp/stanza,stanza/utils/training/common.py,2023-08-17T06:29:41Z,Functionality for run_lemma.py to know what the correct model filename is before rejecting a model rebuild
github.com/stanfordnlp/stanza,stanza/utils/training/common.py,2023-08-17T06:29:41Z,Add the charlm to the run_lemma script
github.com/stanfordnlp/stanza,stanza/utils/training/common.py,2023-08-14T21:44:46Z,Nest things a little more cleanly inside an if statement
github.com/stanfordnlp/stanza,stanza/utils/training/common.py,2023-07-04T12:41:15Z,"When running the charlm using run_charlm, add the arguments from the charlm's parser to the help message"
github.com/stanfordnlp/stanza,stanza/utils/training/common.py,2023-06-30T23:56:48Z,Downloads of missing models for the tests etc should go to the chosen model_dir
github.com/stanfordnlp/stanza,stanza/utils/training/common.py,2023-06-30T15:04:34Z,Refactor choosing the pos_charlm to a separate method which already has the imported default_charlms & pos_charlms
github.com/stanfordnlp/stanza,stanza/utils/training/common.py,2023-06-28T18:57:37Z,Add defaults to the argparser when asked for --help (although some None values get cluttered)
github.com/stanfordnlp/stanza,stanza/utils/training/common.py,2023-06-22T15:27:56Z,Add notes on a Chinese Electra model which does better than the Roberta model we had used
github.com/stanfordnlp/stanza,stanza/utils/training/common.py,2023-05-18T04:55:54Z,Add some notes on FR POS tagging bert results
github.com/stanfordnlp/stanza,stanza/utils/training/common.py,2023-05-07T23:09:27Z,Save some notes on which HE transformer gets the best scores on POS & depparse
github.com/stanfordnlp/stanza,stanza/utils/training/common.py,2023-05-04T01:07:32Z,Log some EN results for conparser w/ finetuning
github.com/stanfordnlp/stanza,stanza/utils/training/common.py,2023-05-02T16:14:27Z,More extensive experiments on the differences between various EN transformers
github.com/stanfordnlp/stanza,stanza/utils/training/common.py,2023-04-30T03:07:29Z,Add a block on a POS experiment using Electra
github.com/stanfordnlp/stanza,stanza/utils/training/common.py,2023-04-28T01:03:02Z,Add some comments on HE experiments we should run
github.com/stanfordnlp/stanza,stanza/utils/training/common.py,2023-03-15T20:25:13Z,Add a chart to the ID transformers for constituency
github.com/stanfordnlp/stanza,stanza/utils/training/common.py,2023-03-13T23:11:06Z,Added code for hy_armtdp - Armenian NER dataset
github.com/stanfordnlp/stanza,stanza/utils/training/common.py,2023-03-13T01:43:44Z,Notes on Indonesian transformers based on some initial experiments on POS.  Need to do constituency and/or NER as well
github.com/stanfordnlp/stanza,stanza/utils/training/common.py,2023-02-28T21:55:26Z,Add notes on which Italian Bert models are working better or worse
github.com/stanfordnlp/stanza,stanza/utils/training/common.py,2022-12-08T07:56:08Z,Add some notes on roberta-base vs roberta-large
github.com/stanfordnlp/stanza,stanza/utils/training/common.py,2022-12-05T00:51:45Z,Update scores for a bunch of Danish transformer models
github.com/stanfordnlp/stanza,stanza/utils/training/common.py,2022-11-22T04:24:56Z,"As a backup, download charlm if lang_charlm was asked for"
github.com/stanfordnlp/stanza,stanza/utils/training/common.py,2022-11-22T01:50:16Z,"Give a more informative error when a charlm cannot be found, but a possibly wrong name was used.  Even better would be to try again with the correct name"
github.com/stanfordnlp/stanza,stanza/utils/training/common.py,2022-10-23T18:25:20Z,Notes on default bert model.  More hidden layers for VI bert by default
github.com/stanfordnlp/stanza,stanza/utils/training/common.py,2022-09-26T15:44:46Z,Add a tiny chart of our own to show what the various columns mean when outputting an evaluation.  Answers #1134
github.com/stanfordnlp/stanza,stanza/utils/training/common.py,2022-09-26T07:27:12Z,Note that combined_bert POS uses the same pretrain as default.  This requires a few minor changes elsewhere to the pretrain chooser
github.com/stanfordnlp/stanza,stanza/utils/training/common.py,2022-09-04T03:51:24Z,"NER Polish (#1110)

* Add NER dataset for Polish

Co-authored-by: ryszardtuora <ryszardtuora@gmail.com>
Co-authored-by: Karol Saputa <ksaputa@gputrain.dariah.ipipan.waw.pl>

This PR adds Polish NER dataset

#1070"
github.com/stanfordnlp/stanza,stanza/utils/training/common.py,2022-09-01T07:37:08Z,no enhanced dependencies
github.com/stanfordnlp/stanza,stanza/utils/training/common.py,2022-08-25T05:10:31Z,Refactor another call to ud_scores
github.com/stanfordnlp/stanza,stanza/utils/training/common.py,2022-08-25T05:07:44Z,Restore the functionality of the ETE (was broken after adding charlm to pos and other changes)
github.com/stanfordnlp/stanza,stanza/utils/training/common.py,2022-08-25T01:07:44Z,Add a simple test of ner_tagger.evaluate()
github.com/stanfordnlp/stanza,stanza/utils/training/common.py,2022-08-03T06:35:42Z,Make the error for an unfinished language (hopefully) more useful
github.com/stanfordnlp/stanza,stanza/utils/training/common.py,2022-07-20T21:14:33Z,"Load the pretrained charlm, adds it as inputs to the POS model

This improves accuracy on almost all POS models

Doing the same thing for depparse would also make sense, but is
currently not done.  However, the downstream scores of depparse don't
seem to be negatively affected by using the different (better) POS
tags produced by models using the pretrained charlm

Add a pos-specific charlm map for the medical EN datasets and the one dataset which appears to be hurt by the charlm (tr_boun)

craft, genia -> None

Produces resources.json with pos charlms

Make the Pipeline pass in charlm paths if present in resources.json
TODO: use the foundation_cache to load them"
github.com/stanfordnlp/stanza,stanza/utils/training/common.py,2022-05-30T07:32:52Z,"Notes on which embeddings are used for which NER, in the form of a map of default pretrains

Use the default pretrains when using run_ner.py

Update prepare_resources to use the new ner embedding info"
github.com/stanfordnlp/stanza,stanza/utils/training/common.py,2022-05-30T04:01:43Z,Use save_name to check if a model already exists
github.com/stanfordnlp/stanza,stanza/utils/training/common.py,2022-04-28T06:59:11Z,Add notes on a German model
github.com/stanfordnlp/stanza,stanza/utils/training/common.py,2022-04-27T05:38:20Z,Better FA option
github.com/stanfordnlp/stanza,stanza/utils/training/common.py,2022-04-24T02:56:27Z,Notes on a Persian bert model choice
github.com/stanfordnlp/stanza,stanza/utils/training/common.py,2022-04-23T04:36:46Z,Move the SHORTNAME_RE from the dataset/training tools to treebank_to_short_name.  Seems to work fine
github.com/stanfordnlp/stanza,stanza/utils/training/common.py,2022-04-23T04:36:46Z,Rename and clarify a comment
github.com/stanfordnlp/stanza,stanza/utils/training/common.py,2022-04-23T04:36:46Z,Automatically download missing pretrain or charlm when training.  Will hopefully make things more convenient
github.com/stanfordnlp/stanza,stanza/utils/training/common.py,2022-04-23T04:36:46Z,Alphabetize bert options
github.com/stanfordnlp/stanza,stanza/utils/training/common.py,2022-04-23T04:36:46Z,Some notes on a FI bert choice
github.com/stanfordnlp/stanza,stanza/utils/training/common.py,2022-04-23T04:36:46Z,A note about which IT roberta to use
github.com/stanfordnlp/stanza,stanza/utils/training/common.py,2022-04-23T04:36:46Z,Refactor the BERT usage from run_constituency to run_ner
github.com/stanfordnlp/stanza,stanza/utils/training/common.py,2022-04-23T04:36:46Z,Convert the run_charlm.sh script to run_charlm.py
github.com/stanfordnlp/stanza,stanza/utils/training/common.py,2022-04-23T04:36:46Z,Get the default pretrain for a conparser or ner model from the resources
github.com/stanfordnlp/stanza,stanza/utils/training/common.py,2022-04-23T04:36:46Z,Reuse the NER code for choosing a charlm to choose the default charlm when running the conparser
github.com/stanfordnlp/stanza,stanza/utils/training/common.py,2022-04-23T04:36:46Z,Refactor (most of) the charlm args so we can add the charlm to run_constituency.py
github.com/stanfordnlp/stanza,stanza/utils/training/common.py,2022-04-23T04:36:46Z,Fix typo
github.com/stanfordnlp/stanza,stanza/utils/training/common.py,2022-04-23T04:36:46Z,"Add a wrapper script for the constituency parser.

Supports each of --train --score_dev and --score_test"
github.com/stanfordnlp/stanza,stanza/utils/training/common.py,2021-07-10T01:33:40Z,Add some comments on the common.py main method
github.com/stanfordnlp/stanza,stanza/utils/training/common.py,2021-05-20T22:54:34Z,Process the --save_dir argument in the training scripts to avoid clobbering existing models when saving somewhere other than the default path
github.com/stanfordnlp/stanza,stanza/utils/training/common.py,2021-05-19T15:47:25Z,"Call the eval script as a module instead of as a script.  This is necessary as, when installing using conda and pip to install directly from github, the executable flag was lost on the eval script."
github.com/stanfordnlp/stanza,stanza/utils/training/common.py,2021-05-18T19:22:21Z,Don't include the program name when parsing args
github.com/stanfordnlp/stanza,stanza/utils/training/common.py,2020-12-21T05:21:51Z,Make it possible to run ETE using one model on a different model's data
github.com/stanfordnlp/stanza,stanza/utils/training/common.py,2020-12-21T05:20:27Z,Convert the end-to-end script to python
github.com/stanfordnlp/stanza,stanza/utils/training/common.py,2020-12-11T03:50:39Z,"Oops, introduced a bug into running on all_ud"
github.com/stanfordnlp/stanza,stanza/utils/training/common.py,2020-12-08T23:13:15Z,"Add a - in the RE for zh-hans, zh-hant, etc"
github.com/stanfordnlp/stanza,stanza/utils/training/common.py,2020-12-08T16:16:34Z,Repeat back the command line arguments we were run with
github.com/stanfordnlp/stanza,stanza/utils/training/common.py,2020-12-03T02:19:10Z,Add the ability to specify shortname directly in the training scripts
github.com/stanfordnlp/stanza,stanza/utils/training/common.py,2020-12-02T04:08:47Z,"Oops, bugfix"
github.com/stanfordnlp/stanza,stanza/utils/training/common.py,2020-12-02T04:06:09Z,"Add a flag to force retraining of existing models.  Otherwise, skip models even when a single model name is given"
github.com/stanfordnlp/stanza,stanza/utils/training/common.py,2020-12-02T01:44:43Z,Cut off a trailing /
github.com/stanfordnlp/stanza,stanza/utils/training/common.py,2020-12-01T22:40:19Z,Make a temp output file name in common.py for the run scripts to use as needed
github.com/stanfordnlp/stanza,stanza/utils/training/common.py,2020-12-01T21:02:56Z,Turn the ad-hoc command line parsing into an argparser.  Includes a temp file option which is currently just a suggestion
github.com/stanfordnlp/stanza,stanza/utils/training/common.py,2020-11-28T18:02:38Z,Move the eval script usage to a common file
github.com/stanfordnlp/stanza,stanza/utils/training/common.py,2020-11-28T08:15:28Z,Lower the noise a little
github.com/stanfordnlp/stanza,stanza/utils/training/common.py,2020-11-28T04:48:46Z,Refactor some stuff out of run_tokenizer
github.com/stanfordnlp/stanza,stanza/models/constituency_parser.py,2024-03-01T03:41:09Z,Add some debug logging when building a retag_pipeline - goal is to make sure it's calling the correct POS model
github.com/stanfordnlp/stanza,stanza/models/constituency_parser.py,2024-02-24T07:41:20Z,Add an option to turn off saving the optimizer when saving each constituency model
github.com/stanfordnlp/stanza,stanza/models/constituency_parser.py,2024-02-24T07:41:20Z,Add flags to control how often the save_each models get saved.  Intent is to make it so that we can skip 10 models at a time and use a series of these to measure the variance in a silver dataset's scores
github.com/stanfordnlp/stanza,stanza/models/constituency_parser.py,2024-02-24T07:41:20Z,Remove unnecessary repetition of existing save_each argument
github.com/stanfordnlp/stanza,stanza/models/constituency_parser.py,2024-02-22T01:31:45Z,Set the trainer logging level to DEBUG when starting a constituency training run.  Switch out a bunch of training log calls to use the training logger specifically to make it easier to log things like the optimizer creation
github.com/stanfordnlp/stanza,stanza/models/constituency_parser.py,2024-02-22T01:31:45Z,"Integrate peft with the constituency parser.

Add a test that the two stage peft is correctly turning off finetuning for the second half of training"
github.com/stanfordnlp/stanza,stanza/models/constituency_parser.py,2024-02-03T03:35:51Z,"Add several resolutions of ambiguous transitions to the top down dynamic oracle.
Also, add a flag which turns on selective oracle transitions, and
automatically ignore transitions after UNKNOWN unless --oracle_level is set

Add an immediate close version of the close/open error.

Add an immediate close version of the close/shift error.

Add an alternate version of the close/shift and close/open resolutions - close at the end of the outer constituent

Proposed fix of Open/Open: turn the new Open into a Unary

Add a fix where open/open is closed at the end of the outer constituent

Add a shift/open ambiguous fix - turn them into Unary

Put the Close for a shift/open at the end, rather than earlier

Includes stats for dev & test scores for various ambiguous transitions"
github.com/stanfordnlp/stanza,stanza/models/constituency_parser.py,2024-01-22T23:47:58Z,Add oracle_level as a parameter to the save name
github.com/stanfordnlp/stanza,stanza/models/constituency_parser.py,2023-12-13T07:27:13Z,Add a flag to not check the transitions or constituents in the dev set
github.com/stanfordnlp/stanza,stanza/models/constituency_parser.py,2023-09-17T00:03:44Z,Add a bit to the name expansion for when to begin finetuning a transformer
github.com/stanfordnlp/stanza,stanza/models/constituency_parser.py,2023-09-02T17:52:46Z,Use the fancy new savename constructions in the run_constituency script
github.com/stanfordnlp/stanza,stanza/models/constituency_parser.py,2023-08-30T18:40:03Z,Comments on an experiment which didn't work out for mixing bert layers
github.com/stanfordnlp/stanza,stanza/models/constituency_parser.py,2023-08-25T05:45:01Z,Add a log of the tensor sizes
github.com/stanfordnlp/stanza,stanza/models/constituency_parser.py,2023-08-14T22:07:08Z,Refactor build_model_filename for run_constituency
github.com/stanfordnlp/stanza,stanza/models/constituency_parser.py,2023-08-14T22:00:12Z,"Add the constituency parser arguments to the run_constituency script, similar to what is done for the lemmatizer & charlm"
github.com/stanfordnlp/stanza,stanza/models/constituency_parser.py,2023-07-24T21:52:49Z,Make a bit of a generalized save name - will add more options as they come up
github.com/stanfordnlp/stanza,stanza/models/constituency_parser.py,2023-06-04T19:13:59Z,Model names were being created with blank spaces in them :/
github.com/stanfordnlp/stanza,stanza/models/constituency_parser.py,2023-05-24T07:30:26Z,"Update con learning rates using a reduce-on-plateau scheme instead of the warmup

The warmup never did anything, so we leave it non-functional for now"
github.com/stanfordnlp/stanza,stanza/models/constituency_parser.py,2023-05-03T21:42:11Z,Add a parameter which attempts to download a saved model for futher processing
github.com/stanfordnlp/stanza,stanza/models/constituency_parser.py,2023-04-04T16:44:09Z,Add a --tokenized_dir argument to the conparser and ensemble scripts which tokenizes all of the text files in a directory in one invocation.  The VLSP group wanted a text repo parsed
github.com/stanfordnlp/stanza,stanza/models/constituency_parser.py,2023-03-27T08:16:55Z,Add notes on an experiment that did nothing in the conparser
github.com/stanfordnlp/stanza,stanza/models/constituency_parser.py,2023-03-24T16:01:17Z,Add a long description of some experiments with low LR for bert and adamw as the second stage optimizer
github.com/stanfordnlp/stanza,stanza/models/constituency_parser.py,2023-03-22T22:04:48Z,"backprop into the transformer...

Add parameters to decide whether or not finetune the transformer
By default, train Bert with a low LR and very low WD to avoid it overreacting to the training data

Check bert_finetune when loading models.  Set it to false if not in the model so that we can preserve old models
Also, check bert_finetune for whether or not to use the foundation_cache when building a new model

Also backprop phobert, xlnet, and bart

Skip the first N steps for finetuning the transformer based on a parameter
Add an endpoint for the bert finetuning as well (another option would be separate initial phase and second phase values)
Add a separate argument for stage1_bert_finetuning
Includes functionality to finetune a limited number of layers

Instead of using the FoundationCache, we need to Load a new copy of
the bert_model if the bert_model was saved in the constituency file
(otherwise, the cached model would be clobered for any other users of
the model)

Add a single epoch test of the bert finetuning

Add a multiepoch test which checks that the weights are or aren't close to the final model in a manner expected by the bert training

Add a per-layer test of the bert backprop - check that if bert_finetune_layers is set, it only backprops the number of layers requested

Include xlnet versions of a couple of the bert tests.  These tests use a copied
tiny-random-xlnet so that the numbers aren't expected to change between iterations

Add a tiny test of the Bart training in conparser
phobert uses a different tokenizer, so we can't directly test it the same way we test the others

A few notes are left behind on things TODO:

TODO: Experiment with a low level of finetuning when using adamw
It would not work well with madgrad yet, since there is an issue where LR==0 still results in learning
https://github.com/facebookresearch/madgrad/issues/16

TODO: when saving a trainer which had its own transformer copy in it,
we need to resave the transformer - currently it gets put into
unsaved_modules if the model wasn't training the transformer
We even leave behind a test which covers that situation, commented out

TODO: when creating an LSTMModel in the Trainer for training a new model,
we need to use a non-cached version of it.  In particular, reusing the
POS tagger later on in training would be a problem
(except we currently don't do that)"
github.com/stanfordnlp/stanza,stanza/models/constituency_parser.py,2023-03-15T20:25:13Z,Fix a comment on the experimental differences
github.com/stanfordnlp/stanza,stanza/models/constituency_parser.py,2023-02-11T01:53:25Z,"Add a flag for reversing the treebanks.  The model will reverse the sentences when making initial word queues, so that the bert & charlm models work as expected

Add a parameter to build_treebank to reverse the trees when building sequences.  Will facilitate parsing in reverse

Reverse sentences at the end of parsing in reverse mode so that we get the correct order back

Reverse sentences when verifying the transitions

Test reversing a sentence when building the transition sequence"
github.com/stanfordnlp/stanza,stanza/models/constituency_parser.py,2023-02-01T07:51:06Z,Clarify some comments on a conparser argument
github.com/stanfordnlp/stanza,stanza/models/constituency_parser.py,2022-12-07T07:06:06Z,"Start passing around device instead of use_cuda

All models now work via the pipeline.  Need to double check that they work everywhere"
github.com/stanfordnlp/stanza,stanza/models/constituency_parser.py,2022-12-05T20:41:18Z,Determine if cuda() is available and use that to set the random seed rather than making that an argument
github.com/stanfordnlp/stanza,stanza/models/constituency_parser.py,2022-12-01T19:20:16Z,Add a reference to more info on nonlinearity
github.com/stanfordnlp/stanza,stanza/models/constituency_parser.py,2022-12-01T19:20:13Z,"Add a maxout linear such as in

https://arxiv.org/pdf/1302.4389v4.pdf

.get() the arg to keep old models alive

Includes some comments on accuracy with maxout"
github.com/stanfordnlp/stanza,stanza/models/constituency_parser.py,2022-11-30T23:43:27Z,"Add large_margin as an option for the loss.

Add a note on a large margin experiment (no improvement)"
github.com/stanfordnlp/stanza,stanza/models/constituency_parser.py,2022-11-25T07:25:04Z,"Add a focal loss option using an external library

Unfortunately, it doesn't seem to improve results"
github.com/stanfordnlp/stanza,stanza/models/constituency_parser.py,2022-11-22T22:07:41Z,Add a bunch of comments on the file layout for the model.  Add a missing citation
github.com/stanfordnlp/stanza,stanza/models/constituency_parser.py,2022-11-22T19:26:01Z,"Default to multistage w/ madgrad if available, adamw if not

Don't set training defaults if we're not training"
github.com/stanfordnlp/stanza,stanza/models/constituency_parser.py,2022-11-17T15:40:32Z,Add an --oracle_level flag which optionally restricts which level to use for the oracle
github.com/stanfordnlp/stanza,stanza/models/constituency_parser.py,2022-11-15T00:12:17Z,Refactor adjusting the prediction string format
github.com/stanfordnlp/stanza,stanza/models/constituency_parser.py,2022-11-14T16:50:55Z,"Add an option to not delete duplicate trees.  Relevant in the case of Vietnamese trees including multiple copies of quad, for example"
github.com/stanfordnlp/stanza,stanza/models/constituency_parser.py,2022-11-14T05:57:59Z,"Add nonlinearity experiments numbers

Update numbers for the tests on nonlinearity. The numbers for the optimizers will follow later."
