repo_url,filepath,commit_date,message
github.com/argosopentech/argos-translate,argostranslate/translate.py,2021-06-15T23:16:29Z,"Upgraded to CTranslate2 2.0

- https://github.com/argosopentech/argos-translate/issues/133
- https://github.com/OpenNMT/CTranslate2/releases/tag/v2.0.0"
github.com/argosopentech/argos-translate,argostranslate/translate.py,2021-06-13T13:14:38Z,Added LibreTranslate translation
github.com/argosopentech/argos-translate,argostranslate/translate.py,2021-06-06T19:02:04Z,Fixed unit tests
github.com/argosopentech/argos-translate,argostranslate/translate.py,2021-06-02T02:39:59Z,Bug fix
github.com/argosopentech/argos-translate,argostranslate/translate.py,2021-06-02T02:24:56Z,Improved logging
github.com/argosopentech/argos-translate,argostranslate/translate.py,2021-06-02T01:58:35Z,"Set min beam size of 4

- https://github.com/argosopentech/argos-translate/issues/121"
github.com/argosopentech/argos-translate,argostranslate/translate.py,2021-06-02T01:53:47Z,Formatting
github.com/argosopentech/argos-translate,argostranslate/translate.py,2021-06-01T11:20:25Z,Update stanza check
github.com/argosopentech/argos-translate,argostranslate/translate.py,2021-06-01T11:20:25Z,Fix None check
github.com/argosopentech/argos-translate,argostranslate/translate.py,2021-06-01T11:20:25Z,Fix logging statements
github.com/argosopentech/argos-translate,argostranslate/translate.py,2021-06-01T11:20:25Z,Minor improvements
github.com/argosopentech/argos-translate,argostranslate/translate.py,2021-05-19T12:21:22Z,Filter available packages by sbd available
github.com/argosopentech/argos-translate,argostranslate/translate.py,2021-05-18T11:58:20Z,Filter installed languages for sbd
github.com/argosopentech/argos-translate,argostranslate/translate.py,2021-05-17T22:10:23Z,"Added code formatting with black

- https://github.com/argosopentech/argos-translate/issues/6"
github.com/argosopentech/argos-translate,argostranslate/translate.py,2021-05-16T12:23:27Z,Auto download sbd package
github.com/argosopentech/argos-translate,argostranslate/translate.py,2021-05-15T01:01:38Z,Improved sentence boundary detection
github.com/argosopentech/argos-translate,argostranslate/translate.py,2021-05-04T00:30:03Z,Renamed warning log to match Python std lib
github.com/argosopentech/argos-translate,argostranslate/translate.py,2021-04-27T12:44:29Z,"Use CTranslate2 to split batches

- https://github.com/argosopentech/argos-translate/issues/97
- https://github.com/argosopentech/argos-translate/commit/0827bebb28c10915814ced9b3de9c56b1c25fe5d#commitcomment-50047147"
github.com/argosopentech/argos-translate,argostranslate/translate.py,2021-04-27T00:36:11Z,"Break long translations over multiple batches

- https://github.com/argosopentech/argos-translate/issues/97"
github.com/argosopentech/argos-translate,argostranslate/translate.py,2021-04-24T20:29:35Z,Sentence boundary detection
github.com/argosopentech/argos-translate,argostranslate/translate.py,2021-04-07T11:12:28Z,Added argos_experimental setting
github.com/argosopentech/argos-translate,argostranslate/translate.py,2021-03-27T12:11:06Z,Deprecated translate.load_installed_languages
github.com/argosopentech/argos-translate,argostranslate/translate.py,2021-03-21T14:51:37Z,"Use list-comprehension instead of `[]*` (multiple reference)

This avoids potential confusions, and also avoids shallow-copying
the class-object."
github.com/argosopentech/argos-translate,argostranslate/translate.py,2021-03-21T14:51:37Z,Add `@staticmethod` to static methods of `ITranslation`
github.com/argosopentech/argos-translate,argostranslate/translate.py,2021-03-21T12:48:02Z,"Port the new combine-results loop from CachedTranslation to PackageTranslation

This prevents potential reference/mem unwanted overwrites, as explained
in 55ee8cd13d"
github.com/argosopentech/argos-translate,argostranslate/translate.py,2021-03-21T12:48:02Z,"Fix wrong output issue for CachedTranslation.hypotheses()

There were two problems observed on the output when using this function
with multi-line input:

* One was wrong indices (`hypotheses_to_return[j]`) being assigned
For multi-line inputs the result always was [..., Hypothesis('', 0)] except
for the first member of the list.
* Second, the += operation was causing single-line results, ignoring all
'\n's that it should add.
* While here take care of extra '\n'-prefix (produced when using ('', 0) objs
to prevent shallow-copy problem)"
github.com/argosopentech/argos-translate,argostranslate/translate.py,2021-03-21T12:48:02Z,"Bugfix: Invalidate cache after `num_hypotheses` changes

After the `num_hypotheses` changes, we possibly have cached translations that
are searched with different beam_search parameters, and also stored in
the lists with different lengths.
The latter becomes problem when combining paragraphs.
So in this case we re-do the search with new parameter(s), and cache the result."
github.com/argosopentech/argos-translate,argostranslate/translate.py,2021-03-21T12:48:02Z,Use a more precise and easier-to-read way for Hypothesis.__str__
github.com/argosopentech/argos-translate,argostranslate/translate.py,2021-03-21T12:48:02Z,"Fix typo in method signature

Just like `split_into_paragraphs()` the `combine_paragraphs()` also
appears being used statically, so the syntax is fixed here."
github.com/argosopentech/argos-translate,argostranslate/translate.py,2021-03-20T18:48:02Z,Fixed rebasing bug
github.com/argosopentech/argos-translate,argostranslate/translate.py,2021-03-20T18:39:05Z,"Implement __str__ and __repr__ for Hypothesis

This makes it easier to debug/represent the objects of this type"
github.com/argosopentech/argos-translate,argostranslate/translate.py,2021-03-20T18:38:03Z,Renamed Hypothesis.output Hypothesis.value
github.com/argosopentech/argos-translate,argostranslate/translate.py,2021-03-20T18:09:29Z,Supported Hypothesis's for CachedTranslation
github.com/argosopentech/argos-translate,argostranslate/translate.py,2021-03-20T17:00:08Z,Implemented Hypothesis's for CompositeTranslations
github.com/argosopentech/argos-translate,argostranslate/translate.py,2021-03-20T15:48:11Z,Documentation for translation module
github.com/argosopentech/argos-translate,argostranslate/translate.py,2021-03-20T14:19:57Z,Added score to hypotheses
github.com/argosopentech/argos-translate,argostranslate/translate.py,2021-03-18T23:23:03Z,Added assertion that sentences within batch size
github.com/argosopentech/argos-translate,argostranslate/translate.py,2021-03-18T23:22:14Z,"Renamed multi_translation

- https://github.com/argosopentech/argos-translate/pull/52
- Formatting"
github.com/argosopentech/argos-translate,argostranslate/translate.py,2021-03-18T22:39:16Z,"Keep the API backwards compatible

Have `translate()` in which we call `multi_translate()` and return the first result."
github.com/argosopentech/argos-translate,argostranslate/translate.py,2021-03-18T22:39:16Z,"Make it possible to return more than one 'hypothetical' translations

This change makes it possible to pass `num_hypotheses` and `beam_size`
to CTranslate and have multiple results returned
Results will be combined and compiled into a list and returned"
github.com/argosopentech/argos-translate,argostranslate/translate.py,2021-03-16T01:23:16Z,Improved logging
github.com/argosopentech/argos-translate,argostranslate/translate.py,2021-03-07T21:39:41Z,"Added more debug statements

- https://github.com/argosopentech/argos-translate/issues/42"
github.com/argosopentech/argos-translate,argostranslate/translate.py,2021-02-19T02:53:04Z,Added DEBUG flag and debugging print statements
github.com/argosopentech/argos-translate,argostranslate/translate.py,2021-02-02T23:58:51Z,Replaced unknowns with source tokens
github.com/argosopentech/argos-translate,argostranslate/translate.py,2021-02-02T23:55:21Z,Factored out tokenization logic
github.com/argosopentech/argos-translate,argostranslate/translate.py,2021-01-23T23:34:37Z,Fixed typo in docs
github.com/argosopentech/argos-translate,argostranslate/translate.py,2021-01-02T16:32:39Z,"Changed CTranslate length_penalty to 0.2

- https://forum.opennmt.net/t/suggested-value-for-length-penalty/4134
- https://github.com/argosopentech/argos-translate/issues/4"
github.com/argosopentech/argos-translate,argostranslate/translate.py,2020-11-01T21:39:26Z,Minor bug fixes
github.com/argosopentech/argos-translate,argostranslate/translate.py,2020-11-01T18:01:10Z,Defaulted to English as the from language
github.com/argosopentech/argos-translate,argostranslate/translate.py,2020-10-31T14:46:08Z,Cached CTranslate Translators
github.com/argosopentech/argos-translate,argostranslate/translate.py,2020-10-22T02:13:08Z,"Switched to properly using CTranslate batches.

As described: https://forum.opennmt.net/t/gui-and-package-system-built-on-opennmt-pretrained-models/3992/6"
github.com/argosopentech/argos-translate,argostranslate/translate.py,2020-09-29T00:30:28Z,Fixed bug in pivoting
github.com/argosopentech/argos-translate,argostranslate/translate.py,2020-09-24T02:39:47Z,Added caching layer
github.com/argosopentech/argos-translate,argostranslate/translate.py,2020-09-24T02:03:20Z,Cleaned up the logic for splitting paragraphs
github.com/argosopentech/argos-translate,argostranslate/translate.py,2020-09-24T01:23:03Z,Swithed translation.Translation to a better interface system
github.com/argosopentech/argos-translate,argostranslate/translate.py,2020-09-20T16:47:33Z,Fixed bug with space at the start of every paragraph
github.com/argosopentech/argos-translate,argostranslate/translate.py,2020-09-20T16:10:47Z,Fixed bug in composite and identity translation
github.com/argosopentech/argos-translate,argostranslate/translate.py,2020-09-17T23:22:14Z,Added support for maintaining newlines into translated text
github.com/argosopentech/argos-translate,argostranslate/translate.py,2020-09-13T21:11:21Z,"Improved documentation

- Fixed this https://github.com/readthedocs/readthedocs.org/issues/2569
error in ReadTheDocs"
github.com/argosopentech/argos-translate,argostranslate/translate.py,2020-09-12T18:10:03Z,Removed excess logging
github.com/argosopentech/argos-translate,argostranslate/translate.py,2020-09-12T17:59:12Z,Refactored translate.py
github.com/argosopentech/argos-translate,argostranslate/translate.py,2020-09-12T15:39:26Z,Fixed bug in translating with multiple packages installed
github.com/argosopentech/argos-translate,argostranslate/translate.py,2020-09-10T01:48:40Z,Improved documentation and some refactoring.
github.com/stanfordnlp/stanza,stanza/tests/tokenization/test_replace_long_tokens.py,2023-11-12T23:29:49Z,"Update the base test to be a bit quicker.  Also, test setting the max length with a flag"
github.com/stanfordnlp/stanza,stanza/tests/tokenization/test_replace_long_tokens.py,2022-10-11T04:16:18Z,"Check for and replace excessively long tokens with ""UNK""; addresses issue 1137 (#1140)

Check for and replace excessively long tokens with ""UNK""; addresses issue 1137.

Added simple test for tokenizer maxlen check
move length check to post tokenization stage"
github.com/stanfordnlp/stanza,stanza/tests/classifiers/test_constituency_classifier.py,2023-02-06T20:44:08Z,Add a test that a fake constituency classifier can be loaded into the pipeline and run on a sentence
github.com/stanfordnlp/stanza,stanza/tests/classifiers/test_constituency_classifier.py,2023-02-06T20:44:08Z,"Add an option to the constituency classifier which uses all words instead of just first/last

The classifier itself uses a max() to pick just one dim to pay attention to"
github.com/stanfordnlp/stanza,stanza/tests/classifiers/test_constituency_classifier.py,2023-02-06T20:44:08Z,"Learn classifier layers on top of a constituency parser as a new classifier model.

Includes a flag to backprop into the constituency parser's weights.
Makes the classifier much more accurate (and slower to train)

Also test saving & loading a model
Add a basic test of the forward pass for the constituency classifier.

In the constituency classifier, extract one layer down instead of ROOT as an option
Also, run 1 head attn over all the nodes as an option

TreeEmbedding is separate from ConstituencyClassifier

This allows reusing the tree embedding as an input to a constituency
classifier (so that a secondary model can give embeddings to the
primary model) or elsewhere as an embedding over words / sentences"
github.com/stanfordnlp/stanza,stanza/tests/pipeline/test_pipeline_depparse_processor.py,2022-09-13T23:26:06Z,Try to reduce the scope on various pipelines to make the test suite less likely to run out of GPU memory.  Not sure this is the correct approach
github.com/stanfordnlp/stanza,stanza/tests/pipeline/test_pipeline_depparse_processor.py,2022-06-28T16:59:08Z,"Add a method to extract the known relations from a dependency parser in a pipeline.  This was already possible using the vocab, but this is significantly easier for a user to find.  #1066"
github.com/stanfordnlp/stanza,stanza/tests/pipeline/test_pipeline_sentiment_processor.py,2022-04-23T04:36:46Z,Move a couple tests into their own pipeline directory
github.com/stanfordnlp/stanza,stanza/tests/pipeline/test_pipeline_constituency_processor.py,2023-01-02T02:50:45Z,"Add a constituency comment to sentences in the doc

This adds the constituency tree to the CoNLL format as a comment

If there's somehow a newline in the parse tree, we convert \n to *NL*
to not make the CoNLL comments horribly broken - not sure this is
ideal, but hopefully \n doesn't come up often"
github.com/stanfordnlp/stanza,stanza/tests/pipeline/test_pipeline_constituency_processor.py,2022-09-17T19:33:13Z,"Maybe save a little GPU memory (fragmentation, at least) by reusing some large data structures"
github.com/stanfordnlp/stanza,stanza/tests/pipeline/test_pipeline_constituency_processor.py,2022-09-08T20:06:30Z,"Add a method to get the constituents known by a conparser, as requested in #1066"
github.com/stanfordnlp/stanza,stanza/tests/pipeline/test_pipeline_constituency_processor.py,2022-04-23T04:36:46Z,Order the items in a constituency query correctly.  Fixes #882
github.com/XiangLi1999/Diffusion-LM,improved-diffusion/control_gen/eval_control.py,2022-06-06T22:38:39Z,first commit
github.com/facebookresearch/minihack,minihack/wiki.py,2021-09-27T23:37:57Z,Initial commit
github.com/turtlesoupy/this-word-does-not-exist,title_maker_pro/datasets.py,2021-01-12T00:08:22Z,Add method for generating words only
github.com/turtlesoupy/this-word-does-not-exist,title_maker_pro/datasets.py,2020-05-18T00:00:17Z,More UD
github.com/turtlesoupy/this-word-does-not-exist,title_maker_pro/datasets.py,2020-05-16T19:09:16Z,Urban dictionary prep
github.com/turtlesoupy/this-word-does-not-exist,title_maker_pro/datasets.py,2020-05-16T03:26:23Z,"Clean notebooks, prepare for urban dictionary run"
github.com/turtlesoupy/this-word-does-not-exist,title_maker_pro/datasets.py,2020-05-15T22:13:13Z,Switch cache to 100K words from 20K
github.com/turtlesoupy/this-word-does-not-exist,title_maker_pro/datasets.py,2020-05-13T04:46:11Z,"Fix full-width CSS, twitter card, filter definitions < 3 words, add favicons"
github.com/turtlesoupy/this-word-does-not-exist,title_maker_pro/datasets.py,2020-05-13T00:55:36Z,Fix twitter bot
github.com/turtlesoupy/this-word-does-not-exist,title_maker_pro/datasets.py,2020-05-09T07:25:23Z,"Word generation: add a hail mary when failing, only do one pass"
github.com/turtlesoupy/this-word-does-not-exist,title_maker_pro/datasets.py,2020-05-07T20:48:32Z,"Wire up basic word service, move word generator interface to own file"
github.com/turtlesoupy/this-word-does-not-exist,title_maker_pro/datasets.py,2020-05-05T18:10:49Z,Use custom inference in twitter bot
github.com/turtlesoupy/this-word-does-not-exist,title_maker_pro/datasets.py,2020-05-05T17:52:32Z,Get rid of example expansion
github.com/turtlesoupy/this-word-does-not-exist,title_maker_pro/datasets.py,2020-05-05T07:52:29Z,Add custom modeling utils with early exit for blacklist / end of sentence
github.com/turtlesoupy/this-word-does-not-exist,title_maker_pro/datasets.py,2020-05-05T05:28:41Z,Upgrade CSS
github.com/turtlesoupy/this-word-does-not-exist,title_maker_pro/datasets.py,2020-05-04T05:42:41Z,"Add twitter card to website, move to training script with creativity evaluation"
github.com/turtlesoupy/this-word-does-not-exist,title_maker_pro/datasets.py,2020-05-03T07:09:26Z,"Move directories, gitignore, dockerize twitter bot"
github.com/AlibabaResearch/DAMO-ConvAI,s2sql/preprocess/common_utils.py,2022-10-18T07:39:05Z,add: s2sql
github.com/BramVanroy/spacy_conll,spacy_conll/utils.py,2023-01-17T10:00:30Z,"fix pretokenized input format

Now, a list of tokens is not valid input anymore"
github.com/BramVanroy/spacy_conll,spacy_conll/utils.py,2022-04-04T12:14:58Z,make style
github.com/BramVanroy/spacy_conll,spacy_conll/utils.py,2022-04-04T12:11:49Z,add create_spacy_disable_sentence_segmentation as entrypoint
github.com/BramVanroy/spacy_conll,spacy_conll/utils.py,2022-04-04T12:03:37Z,move merge_dicts_strict to utils
github.com/BramVanroy/spacy_conll,spacy_conll/utils.py,2022-03-05T19:57:36Z,Allow disable_sbd for stanza
github.com/BramVanroy/spacy_conll,spacy_conll/utils.py,2022-03-05T16:26:10Z,"Allow users to disable spacy components and fix disable_sbd issue

Fixes #17"
github.com/BramVanroy/spacy_conll,spacy_conll/utils.py,2021-09-05T08:52:39Z,ignore import quality checks
github.com/BramVanroy/spacy_conll,spacy_conll/utils.py,2021-06-29T13:48:38Z,avoid duplicate arguments: pop
github.com/BramVanroy/spacy_conll,spacy_conll/utils.py,2021-06-29T13:11:02Z,make style
github.com/BramVanroy/spacy_conll,spacy_conll/utils.py,2021-06-29T11:23:52Z,Update utils.py
github.com/BramVanroy/spacy_conll,spacy_conll/utils.py,2021-06-29T10:04:58Z,remove default spacy parser
github.com/BramVanroy/spacy_conll,spacy_conll/utils.py,2021-06-25T13:58:50Z,move parsing code to dataclass
github.com/BramVanroy/spacy_conll,spacy_conll/utils.py,2021-06-23T16:04:23Z,auto-download udpipe models
github.com/BramVanroy/spacy_conll,spacy_conll/utils.py,2021-06-23T15:41:12Z,update to spacy v3 pipeline
github.com/BramVanroy/spacy_conll,spacy_conll/utils.py,2021-06-23T09:29:25Z,make style
github.com/BramVanroy/spacy_conll,spacy_conll/utils.py,2020-05-11T16:47:25Z,make style && make quality
github.com/BramVanroy/spacy_conll,spacy_conll/utils.py,2020-05-11T16:44:28Z,add ability to use is_tokenized for udpipe
github.com/BramVanroy/spacy_conll,spacy_conll/utils.py,2020-05-05T16:48:44Z,docstring & typing
github.com/BramVanroy/spacy_conll,spacy_conll/utils.py,2020-05-05T16:36:09Z,"replace tokens_from_list by custom tokenizer

Since tokens_from_list is deprecated, switch to a custom tokenizer when `is_tokenized` is requested. Input can be a string to be split on whitespace or a list of tokens. Works only for spaCy. Inspired by adrianeboyd https://github.com/explosion/spaCy/issues/5399#issuecomment-623593208"
github.com/BramVanroy/spacy_conll,spacy_conll/utils.py,2020-05-03T15:39:12Z,style and quality
github.com/BramVanroy/spacy_conll,spacy_conll/utils.py,2020-05-03T15:15:14Z,rename pipeline_opts to parser_opts
github.com/BramVanroy/spacy_conll,spacy_conll/utils.py,2020-05-01T16:51:59Z,allow pipeline_opts and kwargs in init_parser
github.com/BramVanroy/spacy_conll,spacy_conll/utils.py,2020-05-01T13:22:57Z,require keywords for less important kwargs
github.com/BramVanroy/spacy_conll,spacy_conll/utils.py,2020-04-30T12:26:27Z,add kwargs
github.com/BramVanroy/spacy_conll,spacy_conll/utils.py,2020-04-30T11:12:16Z,re-order arguments in init_nlp
github.com/BramVanroy/spacy_conll,spacy_conll/utils.py,2020-04-29T13:13:32Z,"restructure and improve entrypoint

- move ConllFormatter to separate file
- add utils and expose init_parser (might be useful for users)
- improve entrypoint usage"
github.com/BLKSerene/Wordless,wordless/wl_nlp/wl_nlp_utils.py,2024-01-13T02:59:55Z,"Settings: Settings - Part-of-speeach Tagging - Tagsets - Mapping Settings - Allow editing of tagset mapping of Stanza's Armenian (Eastern), Armenian (Western), Basque, Buryat (Russia), Danish, French, Greek (Modern), Hebrew (Modern), Hungarian, Ligurian, Manx, Marathi, Nigerian Pidgin, Pomak, Portuguese, Russian, Sanskrit, Sindhi, Sorbian (Upper), and Telugu part-of-speech taggers"
github.com/BLKSerene/Wordless,wordless/wl_nlp/wl_nlp_utils.py,2024-01-05T07:57:03Z,Misc: Update copyright year
github.com/BLKSerene/Wordless,wordless/wl_nlp/wl_nlp_utils.py,2024-01-02T12:47:42Z,Dependencies: Add VADER; Utils: Add VADER's sentiment analyzers
github.com/BLKSerene/Wordless,wordless/wl_nlp/wl_nlp_utils.py,2023-12-30T10:49:39Z,Dependencies: Upgrade Stanza to 1.7.0; Utils: Add Stanza's Sindhi part-of-speech tagger
github.com/BLKSerene/Wordless,wordless/wl_nlp/wl_nlp_utils.py,2023-10-02T14:14:35Z,Dependencies: Upgrade spaCy to 3.7.2; Utils: Fix downloading of Stanza models
github.com/BLKSerene/Wordless,wordless/wl_nlp/wl_nlp_utils.py,2023-09-27T10:45:09Z,Dependencies: Upgrade PyInstaller to 6.0
github.com/BLKSerene/Wordless,wordless/wl_nlp/wl_nlp_utils.py,2023-09-23T11:43:01Z,Utils: Update spaCy's sentencizer
github.com/BLKSerene/Wordless,wordless/wl_nlp/wl_nlp_utils.py,2023-09-10T09:30:26Z,Utils: Add Stanza's French (Old) lemmatizer
github.com/BLKSerene/Wordless,wordless/wl_nlp/wl_nlp_utils.py,2023-09-10T08:49:05Z,"Utils: Remove Stanza's Swedish Sign Language sentence tokenizer, word tokenizer, part-of-speech tagger, and dependency parser"
github.com/BLKSerene/Wordless,wordless/wl_nlp/wl_nlp_utils.py,2023-09-10T08:43:01Z,"Dependencies: Upgrade Stanza to 1.5.1; Utils: Add Stanza's Hebrew (Ancient), Kyrgyz, Manx, and Pomak sentence tokenizers / word tokenizers / part-of-speech taggers / lemmatizers / dependency parsers"
github.com/BLKSerene/Wordless,wordless/wl_nlp/wl_nlp_utils.py,2023-09-04T13:45:52Z,Utils: Add Stanza's sentiment analyzers
github.com/BLKSerene/Wordless,wordless/wl_nlp/wl_nlp_utils.py,2023-09-03T18:08:00Z,"Dependencies: Add Stanza; Utils: Add Stanza's sentence tokenizers, word tokenizers, part-of-speech taggers, lemmatizers, and dependency parsers"
github.com/BLKSerene/Wordless,wordless/wl_nlp/wl_nlp_utils.py,2023-08-17T17:46:36Z,Misc: Update translations
github.com/BLKSerene/Wordless,wordless/wl_nlp/wl_nlp_utils.py,2023-08-11T16:36:09Z,Dependencies: Add Dostoevsky; Settings: Add Settings - Sentiment Analysis; Utils: Add Dostoevsky's Russian sentiment analyzer
github.com/BLKSerene/Wordless,wordless/wl_nlp/wl_nlp_utils.py,2023-08-08T13:51:22Z,"Utils: Update spaCy's sentence recognizers, word tokenizers, part-of-speech taggers, lemmatizers, and dependency parsers"
github.com/BLKSerene/Wordless,wordless/wl_nlp/wl_nlp_utils.py,2023-07-23T06:44:18Z,"Utils: Add spaCy's Slovenian sentence recognizer, part-of-speech tagger, lemmatizer, and dependency parser"
github.com/BLKSerene/Wordless,wordless/wl_nlp/wl_nlp_utils.py,2023-07-22T17:31:56Z,"Utils: Add spaCy's Korean sentence recognizer, word tokenizer, part-of-speech tagger, lemmatizer, and dependency parser"
github.com/BLKSerene/Wordless,wordless/wl_nlp/wl_nlp_utils.py,2023-03-13T19:09:27Z,Dependencies: Add python-mecab-ko; Utils: Add python-mecab-ko's MeCab
github.com/BLKSerene/Wordless,wordless/wl_nlp/wl_nlp_utils.py,2023-02-10T13:24:56Z,Releases: Update packaging script
github.com/BLKSerene/Wordless,wordless/wl_nlp/wl_nlp_utils.py,2023-02-08T15:13:01Z,Dependencies: 1. Add pymorphy3 2. Remove pymorphy2
github.com/BLKSerene/Wordless,wordless/wl_nlp/wl_nlp_utils.py,2023-02-02T06:42:01Z,Settings: Update global settings - measures
github.com/BLKSerene/Wordless,wordless/wl_nlp/wl_nlp_utils.py,2023-01-30T16:05:14Z,Utils: Speed up n-gram/skip-gram generation
github.com/BLKSerene/Wordless,wordless/wl_nlp/wl_nlp_utils.py,2023-01-19T16:15:38Z,Misc: Update copyright year
github.com/BLKSerene/Wordless,wordless/wl_nlp/wl_nlp_utils.py,2022-10-30T15:50:33Z,Work Area: Add Dependency Parser
github.com/BLKSerene/Wordless,wordless/wl_nlp/wl_nlp_utils.py,2022-10-09T20:25:53Z,"Utils: Update spaCy's sentence tokenizers, word tokenizers, part-of-speech taggers, and lemmatizers"
github.com/BLKSerene/Wordless,wordless/wl_nlp/wl_nlp_utils.py,2022-10-06T19:35:05Z,Utils: Update spaCy's sentence recognizers
github.com/BLKSerene/Wordless,wordless/wl_nlp/wl_nlp_utils.py,2022-09-23T19:51:17Z,Releases: Update packaging script
github.com/BLKSerene/Wordless,wordless/wl_nlp/wl_nlp_utils.py,2022-09-20T19:50:34Z,Utils: Add spaCy's Ukrainian part-of-speech tagger and lemmatizer
github.com/BLKSerene/Wordless,wordless/wl_nlp/wl_nlp_utils.py,2022-09-04T13:36:51Z,Utils: Add spaCy's Finnish part-of-speech tagger and lemmatizer
github.com/BLKSerene/Wordless,wordless/wl_nlp/wl_nlp_utils.py,2022-09-03T18:31:20Z,Utils: Add spaCy's Croatian and Swedish part-of-speech taggers
github.com/BLKSerene/Wordless,wordless/wl_nlp/wl_nlp_utils.py,2022-09-03T14:08:35Z,Utils: 1. Add spaCy's Sorbian (Lower) word tokenizer and stop word list 2. Add spaCy's Sorbian (Upper) word tokenizer and stop word list
github.com/BLKSerene/Wordless,wordless/wl_nlp/wl_nlp_utils.py,2022-09-02T18:45:32Z,Utils: Add Pyphen's Catalan syllable tokenizer
github.com/BLKSerene/Wordless,wordless/wl_nlp/wl_nlp_utils.py,2022-08-25T16:55:28Z,Utils: Add NLTK's legality syllable tokenizer and sonority sequencing syllable tokenizer
github.com/BLKSerene/Wordless,wordless/wl_nlp/wl_nlp_utils.py,2022-08-25T09:29:24Z,Tests: Add CI - SonarCloud
github.com/BLKSerene/Wordless,wordless/wl_nlp/wl_nlp_utils.py,2022-08-23T08:58:22Z,Utils: Add NLTK's regular-expression tokenizer
github.com/BLKSerene/Wordless,wordless/wl_nlp/wl_nlp_utils.py,2022-08-22T10:35:55Z,Dependencies: 1. Add spacy-pkuseg 2. Remove pkuseg
